run_tag	val_bpb	artifact_bytes	time	train_peak_rss_bytes	status	description
2026-03-30_mlx_quick_int5_group64_headint8_lzma_lowrankr1_actscale_calib128_val32768_skipfloat	1.91096857	7071740	16:43.73	1542324224	discard	Rank-1 activation-shaped low-rank residual correction on the INT5 grouped body with an INT8 tied head; deterministic 128-sequence activation calibration before lzma serialization
2026-03-30_mlx_quick_int4_group64_tiedemb_fp16_lzma_nf4_val32768_skipfloat	1.91926966	6453082	16:39.47	1542193152	keep	NF4-style scalar codebook on the INT4 grouped body with fp16 tied head and lzma serialization
2026-03-30_mlx_quick_int4_group64_headint8_lzma_nf4_val32768_skipfloat	1.96536392	5968554	16:39.27	1540882432	discard	NF4-style scalar codebook on the INT4 grouped body with an INT8 tied head and lzma serialization
2026-03-30_mlx_quick_int4_group64_tiedemb_fp16_lzma_rht_nf4_val32768_skipfloat	1.91585948	6567758	16:40.15	1541603328	keep	Randomized-Hadamard rotation plus NF4-style scalar codebook on the INT4 grouped body with fp16 tied head and lzma serialization
2026-03-30_mlx_quick_int4_group64_headint8_lzma_rht_nf4_val32768_skipfloat	1.97450040	6091642	16:39.59	1541373952	discard	Randomized-Hadamard rotation plus NF4-style scalar codebook on the INT4 grouped body with an INT8 tied head and lzma serialization
2026-04-02_mlx_quick_int4_group64_tiedemb_fp16_lzma_nf4_awq_calib128_val32768_skipfloat	1.91518198	7114334	16:53.95	1542029312	keep	AWQ plus NF4 on the INT4 grouped body with fp16 tied head; 128 deterministic calibration sequences and lzma serialization
2026-04-02_mlx_quick_int4_group64_tiedemb_fp16_lzma_rht_nf4_awq_calib128_val32768_skipfloat	1.94967335	7242222	16:56.19	1543159808	discard	Randomized-Hadamard rotation plus AWQ plus NF4 on the INT4 grouped body with fp16 tied head; 128 deterministic calibration sequences and lzma serialization
2026-04-02_mlx_quick_int4_group64_tiedemb_fp16_lzma_nf4_sparseresid001_val32768_skipfloat	1.91833416	6414214	16:49.09	1542586368	keep	Sparse residual correction on top of NF4 for the INT4 grouped body with fp16 tied head; keep the top 0.1% residual weights before lzma serialization
2026-04-02_mlx_quick_int4_group64_tiedemb_fp16_lzma_rht_nf4_sparseresid001_val32768_skipfloat	1.91745501	6593014	16:48.35	1542897664	discard	Randomized-Hadamard rotation plus sparse residual correction on top of NF4 for the INT4 grouped body with fp16 tied head; keep the top 0.1% residual weights before lzma serialization
2026-04-02_mlx_quick_int4_group64_tiedemb_fp16_lzma_nf4_lowrankr1_val32768_skipfloat	1.91891057	6508318	16:40.18	1542144000	discard	Rank-1 low-rank residual correction on top of NF4 for the INT4 grouped body with fp16 tied head before lzma serialization
2026-04-02_mlx_quick_int4_group64_tiedemb_fp16_lzma_rht_nf4_lowrankr1_val32768_skipfloat	1.92091147	6629686	16:42.93	1540554752	discard	Randomized-Hadamard rotation plus rank-1 low-rank residual correction on top of NF4 for the INT4 grouped body with fp16 tied head before lzma serialization
2026-04-02_mlx_quick_int4_group64_tiedemb_fp16_lzma_fp4_val32768_skipfloat	1.95110242	6563991	16:57.55	1540833280	discard	FP4-style scalar codebook on the INT4 grouped body with fp16 tied head and lzma serialization
2026-04-02_mlx_quick_int4_group64_tiedemb_fp16_lzma_rht_fp4_val32768_skipfloat	1.95381690	6556999	16:42.40	1541931008	discard	Randomized-Hadamard rotation plus FP4-style scalar codebook on the INT4 grouped body with fp16 tied head and lzma serialization
2026-04-02_mlx_quick_int4_group64_tiedemb_fp16_lzma_af4_val32768_skipfloat	1.91626946	7053839	16:39.56	1541668864	discard	AF4-style scalar codebook on the INT4 grouped body with fp16 tied head and lzma serialization
2026-04-02_mlx_quick_int4_group64_tiedemb_fp16_lzma_rht_af4_val32768_skipfloat	1.91166653	7065611	16:40.16	1542078464	keep	Randomized-Hadamard rotation plus AF4-style scalar codebook on the INT4 grouped body with fp16 tied head and lzma serialization
2026-04-02_mlx_quick_int4_group64_tiedemb_fp16_lzma_signroundlite_calib128_val32768_skipfloat	1.94582243	4965347	16:47.08	1540816896	keep	SignRound-inspired per-group reconstruction search on uniform INT4 group-of-64 quantization with fp16 tied head and lzma serialization; 128 deterministic calibration sequences
2026-04-02_mlx_quick_int4_group64_tiedemb_fp16_lzma_rht_signroundlite_calib128_val32768_skipfloat	1.94992398	5118327	16:50.73	1542995968	discard	SignRound-inspired per-group reconstruction search on randomized-Hadamard rotated uniform INT4 group-of-64 quantization with fp16 tied head and lzma serialization; 128 deterministic calibration sequences
2026-04-02_mlx_quick_int5_group64_tiedemb_fp16_lzma_signroundlite_calib128_val32768_skipfloat	1.91132505	7186879	16:47.78	1543208960	maybe	SignRound-inspired per-group reconstruction search on uniform INT5 group-of-64 quantization with fp16 tied head and lzma serialization; 128 deterministic calibration sequences
2026-04-02_mlx_quick_int5_group64_tiedemb_fp16_lzma_rht_signroundlite_calib128_val32768_skipfloat	1.90693169	7344331	16:53.47	1542832128	keep	SignRound-inspired per-group reconstruction search on randomized-Hadamard rotated uniform INT5 group-of-64 quantization with fp16 tied head and lzma serialization; 128 deterministic calibration sequences
2026-04-02_mlx_quick_int4_group64_tiedemb_fp16_lzma_nf4_signroundlite_calib128_val32768_skipfloat	1.91733550	6365991	16:49.95	1543651328	keep	SignRound-inspired per-group reconstruction search on NF4 group-of-64 quantization with fp16 tied head and lzma serialization; 128 deterministic calibration sequences
2026-04-02_mlx_quick_int4_group64_tiedemb_fp16_lzma_rht_nf4_signroundlite_calib128_val32768_skipfloat	1.91957215	6494743	16:54.37	1543143424	discard	SignRound-inspired per-group reconstruction search on randomized-Hadamard rotated NF4 group-of-64 quantization with fp16 tied head and lzma serialization; 128 deterministic calibration sequences
2026-04-02_mlx_quick_int4_group64_tiedemb_fp16_lzma_signroundlite_awq_calib128_val32768_skipfloat	1.94038920	5774051	17:02.16	1542914048	review	Depth follow-up: SignRound-inspired per-group reconstruction search plus AWQ on uniform INT4 group-of-64 quantization with fp16 tied head and lzma serialization; 128 deterministic calibration sequences
2026-04-02_mlx_quick_int4_group64_tiedemb_fp16_lzma_nf4_signroundlite_awq_calib128_val32768_skipfloat	1.91179029	7105731	16:55.13	1543241728	review	Depth follow-up: SignRound-inspired per-group reconstruction search plus AWQ on NF4 group-of-64 quantization with fp16 tied head and lzma serialization; 128 deterministic calibration sequences
2026-04-02_mlx_quick_int4_group64_tiedemb_fp16_lzma_af4_signroundlite_calib128_val32768_skipfloat	1.91629980	7011839	16:45.22	1542881280	review	Depth follow-up: SignRound-inspired per-group reconstruction search on AF4 group-of-64 quantization with fp16 tied head and lzma serialization; 128 deterministic calibration sequences
2026-04-02_mlx_quick_int4_group64_tiedemb_fp16_lzma_rht_af4_signroundlite_calib128_val32768_skipfloat	1.91070634	7038923	16:47.91	1542406144	review	Depth follow-up: SignRound-inspired per-group reconstruction search on randomized-Hadamard rotated AF4 group-of-64 quantization with fp16 tied head and lzma serialization; 128 deterministic calibration sequences
2026-04-02_mlx_quick_int5_group64_tiedemb_fp16_lzma_signroundlite_awq_calib128_val32768_skipfloat	1.90723699	7878027	16:46.12	1542651904	review	Depth follow-up: SignRound-inspired per-group reconstruction search plus AWQ on uniform INT5 group-of-64 quantization with fp16 tied head and lzma serialization; 128 deterministic calibration sequences
2026-04-02_mlx_quick_int5_group64_tiedemb_fp16_lzma_rht_signroundlite_awq_calib128_val32768_skipfloat	1.93513450	8076863	16:49.78	1542782976	review	Depth follow-up: SignRound-inspired per-group reconstruction search plus AWQ on randomized-Hadamard rotated uniform INT5 group-of-64 quantization with fp16 tied head and lzma serialization; 128 deterministic calibration sequences
2026-04-02_mlx_quick_int4_group64_tiedemb_fp16_lzma_signroundlite_sparseresid001_calib128_val32768_skipfloat	1.94136031	5067407	16:42.88	1542569984	review	Depth follow-up: SignRound-inspired per-group reconstruction search plus sparse residual correction on uniform INT4 group-of-64 quantization with fp16 tied head and lzma serialization; 128 deterministic calibration sequences
2026-04-02_mlx_quick_int4_group64_tiedemb_fp16_lzma_nf4_signroundlite_sparseresid001_calib128_val32768_skipfloat	1.91295851	6453579	16:44.94	1542750208	review	Depth follow-up: SignRound-inspired per-group reconstruction search plus sparse residual correction on NF4 group-of-64 quantization with fp16 tied head and lzma serialization; 128 deterministic calibration sequences
2026-04-02_mlx_quick_int6_group64_tiedemb_fp16_lzma_rht_rotseed7_val32768_skipfloat	1.90148865	9449134	16:39.33	1540636672	review	SpinQuant-inspired rotation-seed sweep: randomized-Hadamard input-column rotation fused into weight-only INT6 grouped RTN quantization with fp16 tied head and lzma serialization; alternate deterministic seed 7
2026-04-02_mlx_quick_int6_group64_tiedemb_fp16_lzma_rht_rotseed2026_val32768_skipfloat	1.90083622	9472566	16:39.44	1540734976	review	SpinQuant-inspired rotation-seed sweep: randomized-Hadamard input-column rotation fused into weight-only INT6 grouped RTN quantization with fp16 tied head and lzma serialization; alternate deterministic seed 2026
2026-04-02_mlx_quick_int5_group64_tiedemb_fp16_lzma_rht_signroundlite_calib128_rotseed7_val32768_skipfloat	1.90890774	7367043	16:44.55	1542029312	review	SpinQuant-inspired rotation-seed sweep: SignRound-inspired per-group reconstruction search on randomized-Hadamard rotated uniform INT5 group-of-64 quantization with fp16 tied head and lzma serialization; 128 deterministic calibration sequences, alternate seed 7
2026-04-02_mlx_quick_int5_group64_tiedemb_fp16_lzma_rht_signroundlite_calib128_rotseed2026_val32768_skipfloat	1.90656680	7369643	16:44.27	1542799360	review	SpinQuant-inspired rotation-seed sweep: SignRound-inspired per-group reconstruction search on randomized-Hadamard rotated uniform INT5 group-of-64 quantization with fp16 tied head and lzma serialization; 128 deterministic calibration sequences, alternate seed 2026
2026-04-02_mlx_quick_int4_group64_tiedemb_fp16_lzma_rht_nf4_rotseed7_val32768_skipfloat	1.91601537	6585390	16:40.13	1541390336	review	SpinQuant-inspired rotation-seed sweep: randomized-Hadamard rotation plus NF4-style scalar codebook on the INT4 grouped body with fp16 tied head and lzma serialization; alternate deterministic seed 7
2026-04-02_mlx_quick_int4_group64_tiedemb_fp16_lzma_rht_nf4_rotseed2026_val32768_skipfloat	1.91637462	6575110	16:42.52	1541701632	review	SpinQuant-inspired rotation-seed sweep: randomized-Hadamard rotation plus NF4-style scalar codebook on the INT4 grouped body with fp16 tied head and lzma serialization; alternate deterministic seed 2026
2026-04-02_mlx_quick_int4_group64_tiedemb_fp16_lzma_rht_af4_rotseed7_val32768_skipfloat	1.91702986	7055323	16:44.55	1542324224	review	SpinQuant-inspired rotation-seed sweep: randomized-Hadamard rotation plus AF4-style scalar codebook on the INT4 grouped body with fp16 tied head and lzma serialization; alternate deterministic seed 7
2026-04-02_mlx_quick_int4_group64_tiedemb_fp16_lzma_rht_af4_rotseed2026_val32768_skipfloat	1.91724363	7071719	16:40.68	1542406144	review	SpinQuant-inspired rotation-seed sweep: randomized-Hadamard rotation plus AF4-style scalar codebook on the INT4 grouped body with fp16 tied head and lzma serialization; alternate deterministic seed 2026
