run_tag	val_bpb	artifact_bytes	time	train_peak_rss_bytes	status	description
2026-03-26_mlx_quickbaseline_int8_rtn_zlib_val32768_skipfloat	1.90859022	12972589	16:45.91	1534263296	keep	Quick baseline with VAL_SUBSET_SEQS=32768 and SKIP_FINAL_FLOAT_VAL=1
2026-03-26_mlx_quick_attnproj_fp16_val32768_skipfloat	1.90831495	15556393	16:50.40	1535180800	keep	Keep all attn.proj.weight tensors in fp16 passthrough
2026-03-26_mlx_quick_cq_fp16_val32768_skipfloat	1.90688970	15664330	16:30.54	1535655936	keep	Keep all attn.c_q.weight tensors in fp16 passthrough
2026-03-26_mlx_quick_tokemb_fp16_val32768_skipfloat	1.90296877	13528468	16:31.44	1534754816	keep	Keep tok_emb.weight in fp16 passthrough
2026-03-26_mlx_quick_b8_mlpproj_fp16_val32768_skipfloat	1.89782535	13806627	16:33.22	1535344640	keep	Keep only blocks.8.mlp.proj.weight in fp16 passthrough
2026-03-26_mlx_quick_top2_mlpproj_fp16_val32768_skipfloat	1.90794527	14356628	16:37.00	1535836160	discard	Keep blocks.8.mlp.proj.weight and blocks.3.mlp.proj.weight in fp16 passthrough
2026-03-26_mlx_quick_int6_rtn_int8store_val32768_skipfloat	1.91171778	9561079	16:31.91	1534967808	keep	Pure INT6 RTN with int8 storage and the same zlib artifact format
2026-03-26_mlx_quick_mseclipsearch_val32768_skipfloat	1.90526995	13120228	16:37.42	1111146496	keep	Per-row and per-tensor MSE clip search over multiple int8 clip quantiles
2026-03-27_mlx_quick_allcv_fp16_val32768_skipfloat	1.90486882	14409723	16:31.56	1534558208	keep	Keep all attn.c_v.weight tensors in fp16 passthrough
2026-03-27_mlx_quick_int6_rtn_packbits_val32768_skipfloat	1.91314486	10531333	16:32.82	1533591552	discard	Pack the same INT6 RTN weights into 6-bit storage before zlib
2026-03-27_mlx_quick_allck_fp16_val32768_skipfloat	1.90747738	14385746	16:38.77	1111719936	discard	Keep all attn.c_k.weight tensors in fp16 passthrough
2026-03-27_mlx_quick_int6_b8_mlpproj_fp16_val32768_skipfloat	1.91199476	10320727	16:34.91	1535262720	discard	INT6 RTN with blocks.8.mlp.proj.weight kept in fp16 passthrough
2026-03-27_mlx_quick_int6_tokemb_fp16_val32768_skipfloat	1.90417061	10007819	16:33.16	1535655936	keep	INT6 RTN with tok_emb.weight kept in fp16 passthrough
2026-03-27_mlx_quick_mseclipsearch_b8_mlpproj_fp16_val32768_skipfloat	1.90395442	13768781	16:33.39	1533411328	discard	MSE clip-search int8 quantization with blocks.8.mlp.proj.weight kept in fp16 passthrough
2026-03-27_mlx_quick_mseclipsearch_tokemb_fp16_val32768_skipfloat	1.90989535	13341918	16:46.68	1110671360	discard	MSE clip-search int8 quantization with tok_emb.weight kept in fp16 passthrough
2026-03-27_mlx_quick_int6_mseclipsearch_val32768_skipfloat	1.91603788	9469098	16:38.48	1535918080	discard	INT6 quantization with per-row or per-tensor MSE clip search instead of fixed RTN clipping
2026-03-27_mlx_quick_b3_mlpproj_fp16_val32768_skipfloat	1.90610433	13737375	16:36.88	1447968768	keep	Keep only blocks.3.mlp.proj.weight in fp16 passthrough
2026-03-27_mlx_quick_b8_mlpfc_fp16_val32768_skipfloat	1.90714566	13764356	17:37.86	1534640128	keep	Keep only blocks.8.mlp.fc.weight in fp16 passthrough
2026-03-27_mlx_quick_tokemb_b8_mlpproj_fp16_val32768_skipfloat	1.93192924	13530023	17:29.23	1535639552	invalid	Keep tok_emb.weight and blocks.8.mlp.proj.weight in fp16 passthrough; confounded by unusually low train step count (1109)
2026-03-27_mlx_quick_int5_tiedemb_fp16_val32768_skipfloat	1.92848979	7645710	17:16.21	1534115840	keep	INT5 RTN for large tensors with the tied embedding/output head kept in fp16
2026-03-27_mlx_quick_int6_group64_tiedemb_fp16_val32768_skipfloat	1.90376429	10045417	16:32.89	1517289472	keep	INT6 with group-of-64 column scales for 2D weights plus the tied embedding/output head kept in fp16
2026-03-27_mlx_quick_int5_group64_tiedemb_fp16_val32768_skipfloat	1.90768788	7841202	16:36.97	1534001152	keep	INT5 with group-of-64 column scales for 2D weights plus the tied embedding/output head kept in fp16
2026-03-27_mlx_quick_int5_group32_tiedemb_fp16_val32768_skipfloat	1.91190363	7846539	16:37.15	1533853696	discard	INT5 with group-of-32 column scales for 2D weights plus the tied embedding/output head kept in fp16
2026-03-27_mlx_quick_int4_group64_tiedemb_fp16_val32768_skipfloat	1.95092453	5433965	16:47.72	1535787008	keep	INT4 with group-of-64 column scales for 2D weights plus the tied embedding/output head kept in fp16
2026-03-27_mlx_quick_int5_group64_headint8_val32768_skipfloat	1.90936325	7531829	16:37.49	1535377408	keep	INT5 with group-of-64 column scales for the model body and the tied embedding/output head quantized to INT8
2026-03-27_mlx_quick_int5_group64_headint6_val32768_skipfloat	1.91650882	7401522	16:36.26	1535754240	discard	INT5 with group-of-64 column scales for the model body and the tied embedding/output head quantized to INT6
2026-03-27_mlx_quick_int5_group64_affine_tiedemb_fp16_val32768_skipfloat	1.90382111	12275926	16:32.78	1535688704	discard	INT5 with affine group-of-64 quantization for 2D weights and the tied embedding/output head kept in fp16
2026-03-27_mlx_quick_int6_group64_headint8_val32768_skipfloat	1.90862195	9688622	16:37.70	1536196608	discard	INT6 with group-of-64 column scales for the model body and the tied embedding/output head quantized to INT8
2026-03-27_mlx_quick_int5_group128_tiedemb_fp16_val32768_skipfloat	1.90816833	7850498	16:34.39	1535606784	discard	INT5 with group-of-128 column scales for 2D weights plus the tied embedding/output head kept in fp16
2026-03-27_mlx_quick_int5_group64_actdiagclip_tiedemb_fp16_val32768_skipfloat	1.90983833	7877369	16:35.98	1535557632	discard	INT5 with group-of-64 column scales and fp16 tied head, but clip levels chosen by activation-diagonal-weighted calibration on a deterministic train-prefix
2026-03-28_mlx_quick_int5_group64_tiedemb_fp16_packbits_val32768_skipfloat	1.91937725	8586009	16:44.11	1535098880	discard	Lossless 5-bit storage for the INT5 group-of-64 body plus fp16 tied head; zlib artifact grew, and the run stopped earlier than the 1320-step reference
2026-03-28_mlx_quick_int5_group64_tiedemb_fp16_lzma_val32768_skipfloat	1.91055288	7203960	16:37.47	1535000576	maybe	LZMA-compressed serialization for INT5 group-of-64 plus fp16 tied head; artifact dropped strongly with a normal stop step, but this run's exact val_bpb lagged the zlib reference
2026-03-28_mlx_quick_int6_group64_tiedemb_fp16_lzma_val32768_skipfloat	1.91490181	8941844	16:54.78	1534902272	maybe	LZMA-compressed serialization for INT6 group-of-64 plus fp16 tied head; artifact dropped strongly, but this run stopped earlier than the 1321-step zlib reference
2026-03-28_mlx_quick_int5_group64_headint8_lzma_val32768_skipfloat	1.91239764	6955121	16:30.77	1535016960	maybe	LZMA-compressed serialization for INT5 group-of-64 with an INT8 tied head; artifact fell to about 6.96 MB with a normal 1329-step stop, but this rerun's exact val_bpb lagged the zlib head-int8 reference
2026-03-28_mlx_quick_int5_group64_top1roleint6_tiedemb_fp16_val32768_skipfloat	1.91639091	8227093	16:43.52	1534689280	discard	Automatic role-level mixed precision upgraded the top INT5-error role family (`mlp.proj.weight`) to INT6 across layers; artifact matched the expected mid-point, but the 1247-step rerun finished with a worse exact val_bpb than the simpler baselines
2026-03-28_mlx_quick_int6_group64_headint8_lzma_val32768_skipfloat	1.90446697	8911671	16:57.37	1535803392	keep	LZMA-compressed serialization for INT6 group-of-64 with an INT8 tied head; with a normal 1322-step stop it cut the artifact to about 8.91 MB and improved exact val_bpb over the zlib head-int8 reference
2026-03-28_mlx_quick_int6_group64_tiedemb_fp16_lzma_rerun_val32768_skipfloat	1.90404065	9136360	16:47.76	1535508480	keep	Clean rerun of LZMA-compressed serialization for INT6 group-of-64 plus fp16 tied head; with a normal 1314-step stop it preserved most of the strong INT6 quality while cutting the artifact to about 9.14 MB
2026-03-28_mlx_quick_int6_group64_tiedemb_fp16_lzma_awq_calib128_val32768_skipfloat	1.90248080	9792607	16:49.27	1536770048	keep	AWQ-style activation-aware column scaling on the INT6 group-of-64 body with fp16 tied head and lzma; 128 deterministic train-prefix calibration sequences
2026-03-28_mlx_quick_int6_group64_tiedemb_fp16_lzma_awq_calib256_val32768_skipfloat	1.90644446	9822335	16:52.66	1535459328	discard	AWQ-style activation-aware column scaling on the INT6 group-of-64 body with fp16 tied head and lzma; 256 deterministic train-prefix calibration sequences
2026-03-28_mlx_quick_int6_group64_headint8_lzma_awq_calib128_val32768_skipfloat	1.90613047	9536075	16:41.15	1536524288	discard	AWQ-style activation-aware column scaling on the INT6 group-of-64 body with INT8 tied head and lzma; tied head left on plain grouped INT8, 128 calibration sequences
2026-03-28_mlx_quick_int6_group64_headint8_lzma_awqhead_calib128_val32768_skipfloat	1.89650511	9525023	16:44.51	1536098304	keep	AWQ-style activation-aware column scaling on the INT6 group-of-64 body with INT8 tied head and lzma; includes AWQ scaling on the tied head using final hidden activations, 128 calibration sequences
2026-03-28_mlx_quick_int5_group64_tiedemb_fp16_lzma_awq_calib128_val32768_skipfloat	1.90306011	7871147	16:49.92	1535705088	keep	AWQ-style activation-aware column scaling on the INT5 group-of-64 body with fp16 tied head and lzma; 128 deterministic train-prefix calibration sequences
2026-03-28_mlx_quick_int5_group64_tiedemb_fp16_lzma_awq_calib256_val32768_skipfloat	1.90463478	7848875	16:55.89	1536638976	discard	AWQ-style activation-aware column scaling on the INT5 group-of-64 body with fp16 tied head and lzma; 256 deterministic train-prefix calibration sequences
2026-03-28_mlx_quick_int5_group64_headint8_lzma_awq_calib128_val32768_skipfloat	1.91075957	7547091	16:55.77	1536294912	discard	AWQ-style activation-aware column scaling on the INT5 group-of-64 body with INT8 tied head and lzma; tied head left on plain grouped INT8, 128 calibration sequences
2026-03-28_mlx_quick_int5_group64_headint8_lzma_awqhead_calib128_val32768_skipfloat	1.91163164	7544123	16:56.82	1536786432	discard	AWQ-style activation-aware column scaling on the INT5 group-of-64 body with INT8 tied head and lzma; includes AWQ scaling on the tied head using final hidden activations, 128 calibration sequences
2026-03-29_mlx_quick_int6_group64_headint8_lzma_awqheadonly_calib128_val32768_skipfloat	1.89921697	8862485	16:50.91	1535393792	keep	Head-only AWQ on the INT6 group-of-64 body with INT8 tied head and lzma; only the tied embedding/output head receives activation-aware scaling, calibrated on 128 deterministic train-prefix sequences
2026-03-29_mlx_quick_int5_group64_headint8_lzma_awqheadonly_calib128_val32768_skipfloat	1.90999629	6940133	16:42.69	1536540672	keep	Head-only AWQ on the INT5 group-of-64 body with INT8 tied head and lzma; only the tied embedding/output head receives activation-aware scaling, calibrated on 128 deterministic train-prefix sequences
2026-03-29_mlx_quick_int4_group64_tiedemb_fp16_lzma_val32768_skipfloat	1.94251809	4997929	16:38.88	1535770624	keep	Plain INT4 group-of-64 quantization with fp16 tied head and lzma serialization for a clean low-bit codec baseline
2026-03-29_mlx_quick_int4_group64_tiedemb_fp16_lzma_awq_calib128_val32768_skipfloat	1.92763699	5888613	16:43.54	1535934464	keep	AWQ-style activation-aware column scaling on the INT4 group-of-64 body with fp16 tied head and lzma; 128 deterministic train-prefix calibration sequences
2026-03-29_mlx_quick_int4_group64_tiedemb_fp16_lzma_awq_calib256_val32768_skipfloat	1.92713597	5901309	16:46.18	1536196608	keep	AWQ-style activation-aware column scaling on the INT4 group-of-64 body with fp16 tied head and lzma; 256 deterministic train-prefix calibration sequences
2026-03-29_mlx_quick_int4_group64_headint8_lzma_val32768_skipfloat	1.94109118	4736241	16:38.23	1535754240	keep	Plain INT4 group-of-64 quantization with an INT8 tied head and lzma serialization for a clean low-bit head-quantized baseline
2026-03-29_mlx_quick_int4_group64_headint8_lzma_awqheadonly_calib128_val32768_skipfloat	1.94645979	4717397	16:46.79	1536000000	discard	Head-only AWQ on the INT4 group-of-64 body with INT8 tied head and lzma; only the tied embedding/output head receives activation-aware scaling, calibrated on 128 deterministic train-prefix sequences
2026-03-30_mlx_quick_int6_group64_headint7_lzma_val32768_skipfloat	1.90383884	8836813	16:43.72	1536081920	keep	INT6 group-of-64 body with an INT7 tied head and lzma serialization; plain grouped quantization without AWQ
2026-03-30_mlx_quick_int6_group64_headint7_lzma_awqheadonly_calib128_val32768_skipfloat	1.90518759	8820525	16:51.38	1535524864	discard	INT6 group-of-64 body with an INT7 tied head and lzma serialization; head-only AWQ on the tied embedding/output head with 128 deterministic train-prefix calibration sequences
2026-03-30_mlx_quick_int6_group64_headint6_lzma_val32768_skipfloat	1.90965122	8755057	16:44.18	1536540672	discard	INT6 group-of-64 body with an INT6 tied head and lzma serialization; plain grouped quantization without AWQ
2026-03-30_mlx_quick_int6_group64_headint6_lzma_awqheadonly_calib128_val32768_skipfloat	1.90536722	8743545	16:49.98	1536131072	maybe	INT6 group-of-64 body with an INT6 tied head and lzma serialization; head-only AWQ on the tied embedding/output head with 128 deterministic train-prefix calibration sequences
2026-03-30_mlx_quick_int5_group64_headint7_lzma_val32768_skipfloat	1.91623056	6773413	16:49.95	1535868928	discard	INT5 group-of-64 body with an INT7 tied head and lzma serialization; plain grouped quantization without AWQ
2026-03-30_mlx_quick_int5_group64_headint7_lzma_awqheadonly_calib128_val32768_skipfloat	1.91325913	6736385	16:53.07	1535737856	maybe	INT5 group-of-64 body with an INT7 tied head and lzma serialization; head-only AWQ on the tied embedding/output head with 128 deterministic train-prefix calibration sequences
2026-03-30_mlx_quick_int5_group64_headint6_lzma_val32768_skipfloat	1.91860802	6663533	16:41.77	1535639552	discard	INT5 group-of-64 body with an INT6 tied head and lzma serialization; plain grouped quantization without AWQ
2026-03-30_mlx_quick_int5_group64_headint6_lzma_awqheadonly_calib128_val32768_skipfloat	1.90805578	6750137	16:45.49	1534820352	keep	INT5 group-of-64 body with an INT6 tied head and lzma serialization; head-only AWQ on the tied embedding/output head with 128 deterministic train-prefix calibration sequences
2026-03-30_mlx_quick_int6_group64_tiedemb_fp16_lzma_gptqlite_calib128_val32768_skipfloat	1.90385399	9162008	16:53.88	1540489216	discard	GPTQ-lite with block-diagonal group-of-64 Hessian calibration on the INT6 grouped body plus fp16 tied head; lzma serialization with 128 deterministic calibration sequences
2026-03-30_mlx_quick_int6_group64_headint8_lzma_gptqlite_calib128_val32768_skipfloat	1.90421939	8936774	16:42.99	1542144000	discard	GPTQ-lite with block-diagonal group-of-64 Hessian calibration on the INT6 grouped body and INT8 tied head; lzma serialization with 128 deterministic calibration sequences
2026-03-30_mlx_quick_int5_group64_tiedemb_fp16_lzma_gptqlite_calib128_val32768_skipfloat	1.90822276	7321278	16:42.95	1541488640	maybe	GPTQ-lite with block-diagonal group-of-64 Hessian calibration on the INT5 grouped body plus fp16 tied head; lzma serialization with 128 deterministic calibration sequences
2026-03-30_mlx_quick_int5_group64_headint8_lzma_gptqlite_calib128_val32768_skipfloat	1.91094056	7057930	16:42.88	1541144576	discard	GPTQ-lite with block-diagonal group-of-64 Hessian calibration on the INT5 grouped body and INT8 tied head; lzma serialization with 128 deterministic calibration sequences
2026-03-30_mlx_quick_int6_group64_tiedemb_fp16_lzma_rht_val32768_skipfloat	1.89738264	9399930	16:43.44	1540702208	keep	Randomized-Hadamard input-column rotation fused into weight-only INT6 grouped RTN quantization with fp16 tied head and lzma serialization
2026-03-30_mlx_quick_int6_group64_headint8_lzma_rht_val32768_skipfloat	1.90630156	9091734	16:42.56	1540096000	discard	Randomized-Hadamard input-column rotation fused into weight-only INT6 grouped RTN quantization with an INT8 tied head and lzma serialization
2026-03-30_mlx_quick_int5_group64_tiedemb_fp16_lzma_rht_val32768_skipfloat	1.91311301	7324402	16:40.56	1539866624	discard	Randomized-Hadamard input-column rotation fused into weight-only INT5 grouped RTN quantization with fp16 tied head and lzma serialization
2026-03-30_mlx_quick_int5_group64_headint8_lzma_rht_val32768_skipfloat	1.91598066	6996350	16:44.48	1539997696	discard	Randomized-Hadamard input-column rotation fused into weight-only INT5 grouped RTN quantization with an INT8 tied head and lzma serialization
2026-03-30_mlx_quick_int6_group64_tiedemb_fp16_lzma_rht_normalq_val32768_skipfloat	1.90064065	11079622	16:40.89	1540030464	discard	TurboQuant-style weight-only proxy: randomized-Hadamard rotation plus normal-quantile non-uniform scalar quantization on the INT6 grouped body with fp16 tied head and lzma serialization
2026-03-30_mlx_quick_int5_group64_tiedemb_fp16_lzma_rht_normalq_val32768_skipfloat	1.90721665	8858046	16:40.91	1540587520	discard	TurboQuant-style weight-only proxy: randomized-Hadamard rotation plus normal-quantile non-uniform scalar quantization on the INT5 grouped body with fp16 tied head and lzma serialization
2026-03-30_mlx_quick_int6_group64_tiedemb_fp16_lzma_rht_gptqlite_calib128_val32768_skipfloat	1.90863337	9362413	16:52.14	1540390912	discard	Depth follow-up on the strongest new family: randomized-Hadamard rotation plus GPTQ-lite block-diagonal calibration on the INT6 grouped body with fp16 tied head and lzma serialization
2026-03-30_mlx_quick_int6_group64_headint8_lzma_rht_gptqlite_calib128_val32768_skipfloat	1.90738722	8999717	16:47.08	1541406720	discard	Randomized-Hadamard rotation plus GPTQ-lite block-diagonal calibration on the INT6 grouped body with an INT8 tied head and lzma serialization
2026-03-30_mlx_quick_int5_group64_tiedemb_fp16_lzma_rht_gptqlite_calib128_val32768_skipfloat	1.91338360	7426285	16:43.90	1542012928	discard	Randomized-Hadamard rotation plus GPTQ-lite block-diagonal calibration on the INT5 grouped body with fp16 tied head and lzma serialization
2026-03-30_mlx_quick_int5_group64_headint8_lzma_rht_gptqlite_calib128_val32768_skipfloat	1.92193947	7123193	16:43.94	1540096000	discard	Randomized-Hadamard rotation plus GPTQ-lite block-diagonal calibration on the INT5 grouped body with an INT8 tied head and lzma serialization
2026-03-30_mlx_quick_int5_group64_tiedemb_fp16_lzma_sparseresid001_val32768_skipfloat	1.91337955	7244789	16:37.52	1540587520	discard	Sparse residual correction family: after INT5 grouped RTN plus fp16 tied head, keep the top 0.1% post-quantization residual weights as fp16 sparse corrections before lzma serialization
2026-03-30_mlx_quick_int5_group64_headint8_lzma_sparseresid001_val32768_skipfloat	1.90897303	6986041	16:37.26	1540718592	maybe	Sparse residual correction on the INT5 grouped body with an INT8 tied head; keep the top 0.1% post-quantization residual weights as fp16 sparse corrections before lzma serialization
2026-03-30_mlx_quick_int4_group64_tiedemb_fp16_lzma_sparseresid002_val32768_skipfloat	1.94823984	5006721	16:42.84	1541095424	discard	Sparse residual correction on the INT4 grouped body with fp16 tied head; keep the top 0.2% post-quantization residual weights as fp16 sparse corrections before lzma serialization
2026-03-30_mlx_quick_int4_group64_headint8_lzma_sparseresid002_val32768_skipfloat	1.94964583	4767997	16:56.49	1541963776	discard	Sparse residual correction on the INT4 grouped body with an INT8 tied head; keep the top 0.2% post-quantization residual weights as fp16 sparse corrections before lzma serialization
2026-03-30_mlx_quick_int4_group64_tiedemb_fp16_lzma_lowrankr1_val32768_skipfloat	1.94780720	5075804	16:43.41	1542602752	discard	Rank-1 low-rank residual correction on the INT4 grouped body with fp16 tied head; plain residual SVD without activation shaping before lzma serialization
2026-03-30_mlx_quick_int4_group64_headint8_lzma_lowrankr1_val32768_skipfloat	1.94988679	4838956	16:43.17	1541292032	discard	Rank-1 low-rank residual correction on the INT4 grouped body with an INT8 tied head; plain residual SVD without activation shaping before lzma serialization
2026-03-30_mlx_quick_int4_group64_tiedemb_fp16_lzma_lowrankr1_actscale_calib128_val32768_skipfloat	1.94579478	5091432	16:47.56	1541931008	discard	Rank-1 activation-shaped low-rank residual correction on the INT4 grouped body with fp16 tied head; deterministic 128-sequence activation calibration before lzma serialization
2026-03-30_mlx_quick_int4_group64_headint8_lzma_lowrankr1_actscale_calib128_val32768_skipfloat	1.94930391	4797480	17:02.24	1541685248	discard	Rank-1 activation-shaped low-rank residual correction on the INT4 grouped body with an INT8 tied head; deterministic 128-sequence activation calibration before lzma serialization
2026-03-30_mlx_quick_int5_group64_tiedemb_fp16_lzma_lowrankr1_val32768_skipfloat	1.90809321	7300404	16:46.17	1542209536	maybe	Rank-1 low-rank residual correction on the INT5 grouped body with fp16 tied head; plain residual SVD without activation shaping before lzma serialization
2026-03-30_mlx_quick_int5_group64_headint8_lzma_lowrankr1_val32768_skipfloat	1.90952976	7069632	16:45.76	1542586368	discard	Rank-1 low-rank residual correction on the INT5 grouped body with an INT8 tied head; plain residual SVD without activation shaping before lzma serialization
2026-03-30_mlx_quick_int5_group64_tiedemb_fp16_lzma_lowrankr1_actscale_calib128_val32768_skipfloat	1.90879706	7337040	16:50.42	1541914624	discard	Rank-1 activation-shaped low-rank residual correction on the INT5 grouped body with fp16 tied head; deterministic 128-sequence activation calibration before lzma serialization
